{
    "$schema": "http://json-schema.org/draft-07/schema#",
    "type": "object",
    "properties": {
        "key": {
            "type": "string",
            "description": "The key of the addon. It should be unique and case sensitive.",
            "pattern": "^[a-z0-9]+$"
        },
        "name": {
            "type": "string",
            "description": "Shown to GMs. Letters, digits, spaces and - ( ) . , : ' &",
            "pattern": "^[a-zA-Z0-9 \\-().,:'&]+$"
        },
        "repositoryUrl": {
            "type": "string",
            "description": "The repository URL of the addon. It should be a valid URL."
        },
        "releaseUrl": {
            "type": "string",
            "description": "The release URL of the addon. It should be a valid URL."
        },
        "version": {
            "description": "Semantic versioning 2.0.0",
            "type": "string",
            "pattern": "^[0-9]+\\.[0-9]+\\.[0-9]+$"
        },
        "description": {
            "type": "string"
        },
        "dependencies": {
            "type": "array",
            "description": "List of dependencies. Each dependency is an object with 'key' and 'version' properties. The 'key' is the field provided in dependency 'key' field",
            "items": {
                "type": "object",
                "properties": {
                    "key": {
                        "type": "string",
                        "description": "The key of the dependency. It should match the 'key' field of the required addon. The key is case sensitive."
                    },
                    "version": {
                        "type": "string",
                        "description": "Optional. The version of the dependency. It should match the 'version' field of the required addon."
                    }
                },
                "required": ["key"]
            }
        },
        "categories": {
            "type": "array",
            "description": "Optional. Keys of the categories this addon belongs to. Each key should match a 'key' in the repository's 'categories' list.",
            "uniqueItems": true,
            "items": {
                "type": "string",
                "pattern": "^[a-z0-9-]+$"
            }
        },
        "author": {
            "type": "string"
        },
        "license": {
            "type": "string"
        }
    },
    "required": ["key", "name", "version"]
}
