{
    "$schema": "https://raw.githubusercontent.com/haffff/NordvikManager-Addons/refs/heads/main/schemas/addon.json",
    "key": "myaddon",
    "name": "My Addon",
    "description": "What the addon adds to a game.",
    "version": "0.0.1",
    "author": "your-github-name",
    "license": "MIT",
    "repositoryUrl": "https://github.com/your-github-name/your-addon"
}
